ID,Risk Description,Likelihood,Impact,Risk Score,Mitigation,Framework Reference,Status,Owner,Review Date
R-01,Excessive privilege on shared admin accounts,Medium,High,12,Enforce JML process and quarterly access reviews,ISO 27001 A.9.2.3 / NIST PR.AC-1,Open,GRC Team,2025-12-01
R-02,Third-party data exposure via vendor breach,Medium,High,12,Conduct vendor security assessments and require SOC 2 reports,ISO 27001 A.15 / SOC 2 CC3.4,Open,Compliance Team,2025-12-01
R-03,Ransomware infection through phishing,Medium,High,12,Security awareness training and EDR deployment,NIST PR.AT / ISO 27001 A.7.2.2,Open,Security Team,2025-12-01
R-04,Unpatched systems exposing vulnerabilities,High,High,15,Implement monthly patching and vulnerability scans,ISO 27001 A.12.6.1 / NIST PR.IP-12,Open,IT Team,2025-12-01
R-05,Policy non-compliance due to lack of training,Medium,Medium,9,Quarterly policy reviews and employee attestations,ISO 27001 A.7.2.2,Open,GRC Team,2025-12-01
R-06,Cloud misconfigurations in storage buckets,Low,High,10,Enable config monitoring and IAM least privilege,ISO 27001 A.12 / SOC 2 CC7,Open,Cloud Admin,2025-12-01

